STAID,STANAME,Final_i,Final_j
6345500,"HEART RIVER NR RICHARDTON, ND",1401,1481
6349000,"HEART RIVER NR MANDAN, ND",1503,1484
6350000,"CANNONBALL RIVER AT REGENT, ND",1379,1448
6352000,"CEDAR CREEK NR HAYNES, ND",1383,1417
6353000,"CEDAR CREEK NR RALEIGH, ND",1471,1403
6354000,"CANNONBALL RIVER AT BREIEN, ND",1504,1433
6354500,"BEAVER CREEK AT LINTON, ND",1559,1417
6354882,OAK CR NEAR WAKPALA SD,1529,1357
6355000,"NORTH FORK GRAND RIVER AT HALEY, ND",1332,1399
6355500,NORTH FORK GRAND R NEAR WHITE BUTTE SD,1389,1377
6356000,SOUTH FORK GRAND R AT BUFFALO SD,1297,1358
6356500,SOUTH FORK GRAND R NEAR CASH SD,1366,1362
6357800,GRAND R AT LITTLE EAGLE SD,1508,1353
6359500,MOREAU R NEAR FAITH SD,1403,1308
6360500,MOREAU R NEAR WHITEHORSE SD,1504,1309
6394000,"BEAVER CREEK NEAR NEWCASTLE, WYO.",1231,1138
6395000,CHEYENNE R AT EDGEMONT SD,1252,1110
6400000,HAT CR NEAR EDGEMONT SD,1270,1100
6400875,HORSEHEAD CR AT OELRICHS SD,1300,1091
6402000,FALL R AT HOT SPRINGS SD,1282,1120
6402500,BEAVER CR NEAR BUFFALO GAP SD,1296,1123
6403300,FRENCH CR ABOVE FAIRBURN SD,1293,1152
6404000,BATTLE CR NEAR KEYSTONE SD,1297,1169
6404998,GRACE COOLIDGE CR NR GAME LODGE NR CUSTER SD,1295,1158
6406000,BATTLE CR AT HERMOSA SD,1309,1163
6408500,SPRING CR NEAR HERMOSA SD,1313,1174
6408700,RHOADS FORK NEAR ROCHFORD SD,1257,1201
6409000,CASTLE CR ABOVE DEERFIELD RES NEAR HILL CITY SD,1260,1188
6410500,"RAPID CR ABOVE PACTOLA RES AT SILVER CITY,  SD",1279,1194
6411500,RAPID CR BELOW PACTOLA DAM SD,1287,1192
6412500,RAPID CR ABOVE CANYON LAKE NEAR RAPID CITY SD,1300,1188
6414000,RAPID CR AT RAPID CITY SD,1307,1192
6418900,"RAPID CR BL SEWAGE TREATMENT PL NR RAPID CITY, SD",1317,1184
6421500,RAPID CR NEAR FARMINGDALE SD,1337,1173
6422500,BOXELDER CR NEAR NEMO SD,1290,1199
6423010,BOXELDER CR NEAR RAPID CITY SD,1302,1197
6423500,"CHEYENNE RIVER NEAR WASTA,SD",1373,1186
6425100,ELK CR NR RAPID CITY SD,1316,1207
6425500,ELK CR NEAR ELM SPRINGS SD,1366,1205
6427500,"BELLE FOURCHE RIVER BEL KEYHOLE RESERVOIR, WY",1187,1236
6428500,BELLE FOURCHE R AT WY-SD STATE LINE,1248,1272
6430500,REDWATER CR AT WY-SD STATE LINE,1248,1252
6431500,SPEARFISH CR AT SPEARFISH SD,1261,1239
6433000,REDWATER RIVER ABOVE BELLE FOURCHE SD,1265,1260
6433500,HAY CR AT BELLE FOURCHE SD,1263,1259
6436000,BELLE FOURCHE R NEAR FRUITDALE SD,1272,1262
6436180,"WHITEWOOD CR ABOVE WHITEWOOD,SD",1279,1234
6436190,WHITEWOOD CREEK NEAR WHITEWOOD SD,1282,1245
6436198,WHITEWOOD CR ABOVE VALE SD,1284,1252
6436760,HORSE CR ABOVE VALE SD,1301,1256
6437000,BELLE FOURCHE R NEAR STURGIS SD,1320,1237
6438000,BELLE FOURCHE RIVER NEAR ELM SPRINGS,1364,1219
6439000,CHERRY CR NEAR PLAINVIEW SD,1405,1257
6441500,BAD R NEAR FORT PIERRE SD,1535,1203
6442500,MEDICINE CR AT KENNEBEC SD,1575,1156
6444000,"WHITE RIVER AT CRAWFORD, NEBR.",1280,1039
6446000,WHITE R NEAR OGLALA SD,1332,1096
6447000,WHITE R NEAR KADOKA SD,1440,1145
6447500,LITTLE WHITE R NEAR MARTIN SD,1429,1080
6449000,LAKE CR BELOW REFUGE NEAR TUTHILL SD,1439,1078
6449100,LITTLE WHITE R NEAR VETAL SD,1461,1071
6449400,ROSEBUD CR AT ROSEBUD SD,1492,1084
6449500,LITTLE WHITE R NEAR ROSEBUD SD,1490,1096
6450500,LITTLE WHITE R BELOW WHITE RIVER SD,1504,1125
6452000,WHITE R NEAR OACOMA SD,1598,1136
6453255,CHOTEAU CR NR AVON SD,1714,1042
6453500,"PONCA CREEK AT ANOKA, NEBR.",1653,1046
6453600,"PONCA CREEK AT VERDEL, NEBR.",1707,1030
6454000,NIOBRARA RIVER AT WYO-NEBR. STATE LINE,1228,1039
6454100,"NIOBRARA RIVER AT AGATE, NEBR.",1248,1011
6454500,"NIOBRARA RIVER ABOVE BOX BUTTE RESERVOIR, NE",1297,1012
6455500,NIOBRARA RIVER BELOW BOX BUTTE RESERVOIR NEBR,1305,1011
6457500,"NIOBRARA RIVER NEAR GORDON, NEBR.",1379,1027
6459500,"SNAKE RIVER NEAR BURGE, NEBR.",1488,1022
6461000,"MINNECHADUZA CREEK AT VALENTINE, NEBR.",1514,1044
6461500,"NIOBRARA RIVER NEAR SPARKS, NEBR.",1530,1046
6462500,"PLUM CREEK AT MEADVILLE, NE",1569,1028
6463500,"LONG PINE CREEK NEAR RIVERVIEW, NEBR.",1586,1021
6464100,KEYA PAHA R NEAR KEYAPAHA SD,1555,1068
6464500,KEYA PAHA R AT WEWELA SD,1579,1057
6464900,"KEYA PAHA RIVER NEAR NAPER, NEBR.",1634,1043
6465000,"NIOBRARA RIVER NEAR SPENCER, NEBR.",1670,1030
6465500,"NIOBRARA RIVER NR. VERDEL, NEBR.",1705,1021
6466500,"BAZILE CREEK NEAR NIOBRARA, NE",1727,1023
6468170,"JAMES RIVER NR GRACE CITY, ND",1667,1559
6469400,"PIPESTEM CREEK NR PINGREE, ND",1658,1516
6470000,"JAMES RIVER AT JAMESTOWN, ND",1679,1484
6470500,"JAMES RIVER AT LAMOURE, ND",1706,1424
6470800,"BEAR CREEK NR OAKES, ND",1726,1408
6470878,JAMES RIVER AT ND-SD STATE LINE,1717,1375
6471000,JAMES R AT COLUMBIA SD,1704,1340
6471200,MAPLE R AT ND-SD STATE LINE,1696,1377
6471500,ELM R AT WESTPORT SD,1690,1347
6473000,JAMES R AT ASHTON SD,1690,1274
6473700,"Snake Creek near Ashton, SD",1688,1269
6473750,WOLF CR NEAR REE HEIGHTS SD,1629,1233
6474000,TURTLE CR NEAR TULARE SD,1684,1244
6474300,MEDICINE CR NEAR ZELL SD,1668,1246
6475000,JAMES R NEAR REDFIELD SD,1689,1263
6476000,JAMES R AT HURON SD,1710,1201
6476500,SAND CR NEAR ALPENA SD,1691,1180
6477000,JAMES R NEAR FORESTBURG SD,1720,1157
6477500,FIRESTEEL CR NEAR MOUNT VERNON SD,1704,1137
6478540,LITTLE VERMILLION R NEAR SALEM SD,1771,1143
6478690,WEST FORK VERMILLION R NEAR PARKER SD,1787,1096
6479010,VERMILLION RIVER NR VERMILLION SD,1811,1029
6479215,BIG SIOUX RIVER NR FLORENCE SD,1793,1292
6479438,BIG SIOUX R NEAR WATERTOWN SD,1793,1272
6479525,BIG SIOUX R NEAR CASTLEWOOD SD,1802,1242
6480000,BIG SIOUX RIVER NEAR BROOKINGS SD,1826,1180
6481000,BIG SIOUX R NEAR DELL RAPIDS SD,1826,1137
6481500,SKUNK CR AT SIOUX FALLS SD,1820,1109
6482020,BIG SIOUX R AT NORTH CLIFF AVE AT SIOUX FALLS SD,1827,1111
6482610,SPLIT ROCK CR AT CORSON SD,1839,1118
6483500,"Rock River near Rock Valley, IA",1862,1072
6485500,"Big Sioux River at Akron, IA",1839,1031
6600000,"Perry Creek at 38th Street, Sioux City, IA",1851,996
6600100,"Floyd River at Alton, IA",1885,1047
6600300,"West Branch Floyd River near Struble, IA",1871,1041
6600500,"Floyd River at James, IA",1860,1002
6601000,"OMAHA CR AT HOMER, NEBR",1845,972
6605000,"Ocheyedan River near Spencer, IA",1950,1063
6605850,"Little Sioux River at Linn Grove, IA",1952,1035
6606600,"Little Sioux River at Correctionville, IA",1902,991
6607200,"Maple River at Mapleton, IA",1900,954
6607500,"Little Sioux River near Turin, IA",1885,933
6608500,"Soldier River at Pisgah, IA",1891,920
6609500,"Boyer River at Logan, IA",1902,898
6614800,"MICHIGAN RIVER NEAR CAMERON PASS, CO.",1054,818
6620000,"NORTH PLATTE RIVER NEAR NORTHGATE, CO",1020,870
6622700,"NORTH BRUSH CREEK NEAR SARATOGA, WY",1011,919
6623800,"ENCAMPMENT RIVER AB HOG PARK CR, NR ENCAMPMENT, WY",982,885
6625000,"ENCAMPMENT RIVER AT MOUTH, NEAR ENCAMPMENT, WY",994,914
6628900,"PASS CREEK NEAR ELK MOUNTAIN, WY",1005,944
6630000,"N PLATTE RIV AB SEMINOE RESERVOIR, NR SINCLAIR, WY",974,980
6632400,"ROCK CREEK AB KING CANYON CANAL, NR ARLINGTON, WY",1038,940
6634620,"L MEDICINE BOW R AT BOLES SPRING, NR MEDICINE BOW",1043,981
6635000,"MEDICINE BOW R AB SEMINOE RESERVOIR, NR HANNA, WY",1021,989
6637750,"ROCK CREEK ABOVE ROCK CREEK RESERVOIR, WYO.",843,1072
6642000,"NORTH PLATTE RIVER AT ALCOVA, WY",1011,1053
6646600,"DEER CREEK BELOW MILLAR WASTEWAY, AT GLENROCK, WY",1084,1078
6646800,"NORTH PLATTE RIVER NEAR GLENROCK, WY",1090,1073
6647500,"BOX ELDER CREEK AT BOXELDER, WY",1081,1049
6652000,"NORTH PLATTE RIVER AT ORIN, WY",1139,1046
6652800,"NORTH PLATTE RIVER BELOW GLENDO RESERVOIR, WY",1151,1026
6656000,"NORTH PLATTE RIVER BELOW GUERNSEY RESERVOIR, WY",1166,1004
6657000,"NORTH PLATTE RIVER BELOW WHALEN DIVERSION DAM, WY",1177,998
6661585,"LARAMIE RIVER NEAR BOSLER, WY",1083,932
6670500,"LARAMIE RIVER NEAR FORT LARAMIE, WY",1183,993
6677500,"HORSE CREEK NEAR LYMAN, NE",1227,959
6678000,"SHEEP CREEK NEAR MORRILL, NEBR.",1229,964
6681500,"GERING DRAIN NEAR GERING, NEBR.",1255,943
6685000,"PUMPKIN CREEK NEAR BRIDGEPORT, NEBR.",1302,919
6687000,"BLUE CREEK NEAR LEWELLEN, NEBR.",1371,882
6692000,"BIRDWOOD CREEK NEAR HERSHEY, NEBR.",1461,864
6695000,"S PLATTE R AB 11-MILE CANYON RE, NR HARTSEL, CO.",1062,645
6696000,"SOUTH PLATTE RIVER NEAR LAKE GEORGE, CO.",1070,639
6696980,"TARRYALL CREEK AT UPPER STATION NEAR COMO, CO",1036,690
6701500,"SOUTH PLATTE RIVER BELOW CHEESMAN LAKE, CO.",1091,671
6706000,"NF SOUTH PLATTE R BELOW GENEVA C, AT GRANT, CO.",1061,700
6709500,"PLUM CREEK NEAR LOUVIERS, CO.",1115,699
6709530,"PLUM CREEK AT TITAN RD NR LOUVIERS, CO",1114,701
6710000,"SOUTH PLATTE RIVER AT LITTLETON, CO.",1117,714
6710385,BEAR CREEK ABOVE EVERGREEN,1090,719
6710500,"BEAR CREEK AT MORRISON, CO.",1102,718
6711500,"BEAR CREEK AT MOUTH, AT SHERIDAN, CO.",1114,717
6711565,"SOUTH PLATTE RIVER AT ENGLEWOOD, CO.",1119,719
6712000,"CHERRY CREEK NEAR FRANKTOWN, CO.",1135,681
6713000,"CHERRY CREEK BELOW CHERRY CREEK LAKE, CO.",1131,714
6714000,"SOUTH PLATTE RIVER AT DENVER, CO.",1119,728
6714215,"SOUTH PLATTE R AT 64TH AVE. COMMERCE CITY, CO.",1123,732
6716500,"CLEAR CREEK NEAR LAWSON, CO.",1067,734
6719505,"CLEAR CREEK AT GOLDEN, CO.",1100,730
6720500,"SOUTH PLATTE RIVER AT HENDERSON, CO.",1133,746
6724000,"ST. VRAIN CREEK AT LYONS, CO.",1103,780
6725450,"ST. VRAIN CREEK BELOW LONGMONT, CO.",1123,771
6725500,"MIDDLE BOULDER CREEK AT NEDERLAND, CO.",1080,755
6727000,"BOULDER CREEK NEAR ORODELL, CO.",1094,758
6729500,"SOUTH BOULDER CREEK NEAR ELDORADO SPRINGS, CO.",1095,750
6730500,"BOULDER CREEK AT MOUTH, NEAR LONGMONT, CO.",1124,772
6731000,"ST. VRAIN CREEK AT MOUTH, NEAR PLATTEVILLE, CO.",1136,783
6733000,"BIG THOMPSON RIVER AT ESTES PARK, CO.",1084,801
6735500,"BIG THOMPSON RIVER NEAR ESTES PARK, CO.",1086,801
6738000,"BIG THOMPSON R AT MOUTH OF CANYON, NR DRAKE, CO.",1108,803
6741510,"BIG THOMPSON RIVER AT LOVELAND, CO.",1120,798
6746095,"JOE WRIGHT CREEK ABOVE JOE WRIGHT RESERVOIR, CO.",1055,822
6746110,"JOE WRIGHT CREEK BELOW JOE WRIGHT RESERVOIR, CO.",1057,825
6752000,"CACHE LA POUDRE R A MO OF CN, NR FT COLLINS, CO.",1111,830
6752260,"CACHE LA POUDRE RIVER AT FORT COLLINS, CO.",1123,821
6752280,"CACHE LA POUDRE R AB BOXELDER C, NR TIMNATH, CO.",1127,816
6752500,"CACHE LA POUDRE RIVER NEAR GREELEY, CO.",1158,798
6754000,"SOUTH PLATTE RIVER NEAR KERSEY, CO.",1164,795
6758500,"SOUTH PLATTE RIVER NEAR WELDONA, CO.",1215,782
6762500,"LODGEPOLE CREEK AT BUSHNELL, NEBR.",1226,881
6772000,"WOOD RIVER NEAR ALDA, NEBR.",1678,813
6775500,"MIDDLE LOUP RIVER AT DUNNING, NEBR.",1547,927
6776500,"DISMAL RIVER AT DUNNING, NE",1547,927
6779000,"MIDDLE LOUP R. AT ARCADIA, NEBR.",1626,877
6783500,"MUD CREEK NEAR SWEETWATER, NE",1634,836
6784000,"SOUTH LOUP R AT ST. MICHAEL, NEBR.",1655,834
6784800,"TURKEY CREEK NEAR DANNEBROG, NEBR.",1671,848
6785000,"MIDDLE LOUP R. AT ST. PAUL, NEBR.",1680,851
6786000,"NORTH LOUP RIVER AT TAYLOR, NEBR.",1606,917
6787500,"CALAMUS RIVER NEAR BURWELL, NEBR.",1623,921
6788500,"NORTH LOUP RIVER AT ORD, NEBR.",1644,898
6790500,NORTH LOUP RIVER NR ST PAUL NEBR,1682,858
6791500,"CEDAR RIVER NEAR SPALDING, NE",1681,909
6792000,"CEDAR RIVER NEAR FULLERTON, NEBR.",1718,873
6793000,"LOUP RIVER NEAR GENOA, NEBR.",1742,874
6794000,"BEAVER CREEK AT GENOA, NEBR.",1740,878
6795500,"SHELL CREEK NEAR COLUMBUS, NEBR.",1779,887
6797500,"ELKHORN RIVER AT EWING, NEBR.",1692,971
6798000,"SOUTH FORK ELKHORN RIVER AT EWING, NEBR.",1686,967
6799000,ELKHORN R AT NORFOLK NE,1767,940
6799100,"NORTH FORK ELKHORN RIVER NEAR PIERCE, NEBR.",1763,956
6799350,"ELKHORN RIVER AT WEST POINT, NEBR.",1825,921
6799450,LOGAN CREEK AT PENDER NE,1826,951
6799500,"LOGAN CREEK NEAR UEHLING, NEBR.",1842,907
6800000,"MAPLE CREEK NEAR NICKERSON, NE",1839,890
6800500,"ELKHORN RIVER AT WATERLOO, NE",1862,860
6803000,"SALT CREEK AT ROCA, NEBR.",1828,790
6803500,"SALT CREEK AT LINCOLN, NEBR.",1827,809
6803510,"LITTLE SALT CREEK NEAR LINCOLN, NEBR.",1828,814
6803520,"STEVENS CREEK NR. LINCOLN, NEBR.",1836,810
6803530,"ROCK CREEK NEAR CERESCO, NEBR.",1839,830
6803555,"SALT CREEK AT GREENWOOD, NEBR.",1846,823
6804000,"WAHOO CREEK AT ITHACA, NEBR.",1838,846
6806500,"WEEPING WATER CREEK AT UNION, NEBR.",1893,805
6807410,"West Nishnabotna River at Hancock, IA",1938,871
6808500,"West Nishnabotna River at Randolph, IA",1920,814
6809210,"East Nishnabotna River near Atlantic, IA",1963,867
6809500,"East Nishnabotna River at Red Oak, IA",1949,829
6810000,"Nishnabotna River above Hamburg, IA",1917,788
6811500,"LITTLE NEMAHA RIVER AT AUBURN, NE",1900,761
6811840,"Tarkio River at Stanton, IA",1959,824
6813000,TARKIO RIVER AT FAIRFAX MO,1935,755
6814000,"TURKEY C NR SENECA, KS",1875,712
6814500,"NORTH FORK BIG NEMAHA RIVER AT HUMBOLDT, NEBR.",1889,734
6815000,"BIG NEMAHA RIVER AT FALLS CITY, NEBR.",1918,722
6817000,"Nodaway River at Clarinda, IA",1968,800
6817700,"Nodaway River near Graham, MO",1964,738
6818750,"Platte River near Diagonal, IA",2019,804
6819185,"East Fork 102 River at Bedford, IA",1994,791
6820500,"Platte River near Agency, MO",1997,684
6821150,"Little Platte River at Smithville, MO",2006,651
6821190,"Platte River at Sharps Station, MO",1995,651
6821500,"ARIKAREE RIVER AT HAIGLER, NEBR.",1378,735
6823500,"BUFFALO CREEK NEAR HAIGLER, NEBR.",1387,737
6824500,"REPUBLICAN RIVER AT BENKELMAN, NEBR.",1414,734
6826500,"SOUTH FORK REPUBLICAN RIVER NEAR HALE, CO.",1358,692
6827500,"SOUTH FORK REPUBLICAN RIVER NEAR BENKELMAN, NEBR",1416,733
6828500,"REPUBLICAN RIVER AT STRATTON, NEBR.",1443,745
6829500,"REPUBLICAN RIVER AT TRENTON, NEBR.",1457,747
6831500,"FRENCHMAN CREEK NEAR IMPERIAL, NEBR.",1409,780
6832500,"FRENCHMAN CREEK NEAR ENDERS, NEBR.",1420,779
6834000,"FRENCHMAN CREEK AT PALISADE, NEBR.",1451,768
6835000,"STINKING WATER CREEK NEAR PALISADE, NEBR.",1452,771
6835500,"FRENCHMAN CREEK AT CULBERTSON, NEBR.",1471,755
6836000,"BLACKWOOD CREEK NEAR CULBERTSON, NEBR.",1479,754
6836500,"DRIFTWOOD CREEK NEAR MC COOK, NEBR.",1488,743
6837000,REPUBLICAN RIVER AT MCCOOK NEBR,1496,746
6837300,"RED WILLOW CREEK ABOVE HUGH BUTLER LAKE, NEBR.",1480,773
6837500,"RED WILLOW CREEK NEAR MCCOOK, NEBR.",1492,766
6838000,"RED WILLOW CREEK NEAR RED WILLOW, NEBR.",1503,753
6840000,"FOX CREEK AT CURTIS, NEBR.",1506,797
6841000,"MEDICINE CREEK ABOVE HARRY STRUNK LAKE, NE",1520,782
6842500,"MEDICINE CREEK BELOW HARRY STRUNK LAKE, NEBR.",1529,767
6843500,"REPUBLICAN RIVER AT CAMBRIDGE, NEBR.",1535,756
6844000,"MUDDY CREEK AT ARAPAHOE, NEBR.",1552,758
6844500,"REPUBLICAN RIVER NEAR ORLEANS, NEBR.",1589,738
6844900,"SF SAPPA C NR ACHILLES, KS",1481,691
6846500,"BEAVER C AT CEDAR BLUFFS, KS",1497,724
6847000,"BEAVER CREEK NEAR BEAVER CITY, NEBR.",1554,737
6847500,"SAPPA CREEK NEAR STAMFORD, NEBR.",1583,736
6847900,"PRAIRIE DOG C AB KEITH SEBELIUS LAKE, KS",1535,698
6848000,"PRAIRIE DOG C AT NORTON, KS",1550,702
6848500,"PRAIRIE DOG C NR WOODRUFF, KS",1589,721
6851000,"CENTER CREEK AT FRANKLIN, NEBR.",1631,732
6851500,"THOMPSON CREEK AT RIVERTON, NEBR.",1651,731
6852000,"ELM CREEK AT AMBOY, NEBR.",1678,729
6853800,"WHITE ROCK C NR BURR OAK, KS",1693,708
6854000,"WHITE ROCK C AT LOVEWELL, KS",1712,707
6855800,"BUFFALO C NR JAMESTOWN, KS",1725,677
6860000,"SMOKY HILL R AT ELKADER, KS",1466,595
6861000,"SMOKY HILL R NR ARNOLD, KS",1537,592
6862000,"SMOKY HILL R AT CEDAR BLUFF DAM, KS",1563,589
6862700,"SMOKY HILL R NR SCHOENCHEN, KS",1592,581
6862850,"SMOKY HILL R BL SCHOENCHEN, KS",1600,580
6863500,"BIG C NR HAYS, KS",1598,596
6863900,"NF BIG C NR VICTORIA, KS",1608,600
6864050,"SMOKY HILL R NR BUNKER HILL, KS",1644,587
6864500,"SMOKY HILL R AT ELLSWORTH, KS",1691,579
6865500,"SMOKY HILL R NR LANGLEY, KS",1715,565
6866500,"SMOKY HILL R NR MENTOR, KS",1747,576
6866900,"SALINE R NR WAKEENEY, KS",1552,626
6867000,"SALINE R NR RUSSELL, KS",1638,606
6868200,"SALINE R AT WILSON DAM, KS",1670,605
6869500,"SALINE R AT TESCOTT, KS",1723,609
6870200,"SMOKY HILL R AT NEW CAMBRIA, KS",1756,593
6871000,"NF SOLOMON R AT GLADE, KS",1602,685
6871500,"BOW C NR STOCKTON, KS",1603,673
6871800,"NF SOLOMON R AT KIRWIN, KS",1618,685
6872500,"NF SOLOMON R AT PORTIS, KS",1654,672
6873000,"SF SOLOMON R AB WEBSTER RE, KS",1578,654
6873200,"SF SOLOMON R BL WEBSTER RE, KS",1593,658
6873460,"SF SOLOMON R AT WOODSTON, KS",1619,660
6874000,"SF SOLOMON R AT OSBORNE, KS",1653,656
6875900,"SOLOMON R NR GLEN ELDER, KS",1690,661
6876700,"SALT C NR ADA, KS",1726,624
6876900,"SOLOMON R AT NILES, KS",1757,605
6877600,"SMOKY HILL R AT ENTERPRISE, KS",1789,598
6878000,"CHAPMAN C NR CHAPMAN, KS",1795,611
6879650,"KINGS C NR MANHATTAN, KS",1834,617
6879900,"BIG BLUE RIVER AT SURPRISE, NEBR.",1775,839
6880000,"LINCOLN CREEK NEAR SEWARD, NEBR.",1788,819
6880500,"BIG BLUE RIVER AT SEWARD, NEBR.",1791,818
6880800,"WEST FORK BIG BLUE RIVER NR DORCHESTER, NEBR.",1785,799
6881000,"BIG BLUE RIVER NEAR CRETE, NEBR.",1803,784
6881200,"TURKEY CREEK NEAR WILBER, NEBR.",1800,771
6881500,BIG BLUE R AT BEATRICE NEBR,1821,746
6882000,BIG BLUE R AT BARNESTON NEBR,1836,723
6882510,"BIG BLUE R AT MARYSVILLE, KS",1829,700
6883000,"LITTLE BLUE RIVER NEAR DEWEESE, NE",1709,756
6883570,"LITTLE BLUE RIVER NEAR ALEXANDRIA (GILEAD), NEBR",1766,739
6884000,"LITTLE BLUE RIVER NEAR FAIRBURY, NEBR.",1786,731
6884025,"LITTLE BLUE R AT HOLLENBERG, KS",1800,716
6884200,"MILL C AT WASHINGTON, KS",1797,696
6884400,"L BLUE R NR BARNES, KS",1816,688
6885500,"BLACK VERMILLION R NR FRANKFORT, KS",1848,682
6887000,"BIG BLUE R NR MANHATTAN, KS",1835,633
6888500,"MILL C NR PAXICO, KS",1871,614
6889100,"SOLDIER C NR GOFF, KS",1889,675
6889120,"SOLDIER C NR BANCROFT, KS",1887,673
6889140,"SOLDIER C NR SOLDIER, KS",1889,670
6889160,"SOLDIER C NR CIRCLEVILLE, KS",1890,658
6889200,"SOLDIER C NR DELIA, KS",1894,633
6889500,"SOLDIER C NR TOPEKA, KS",1909,615
6890100,"DELAWARE R NR MUSCOTAH, KS",1926,665
6890900,"DELAWARE R BL PERRY DAM, KS",1935,615
6891500,"WAKARUSA R NR LAWRENCE, KS",1948,598
6892000,"STRANGER C NR TONGANOXIE, KS",1969,618
6893080,"BLUE R NR STANLEY, KS",2000,587
6893300,"INDIAN C AT OVERLAND PARK, KS",2001,600
6893500,"Blue River at Kansas City, MO",2009,603
6893793,"L. Blue R. below Longview D.S. at KC, MO",2017,600
6893890,"East Fork Little Blue River nr Blue Springs, MO",2028,610
6894000,"Little Blue River near Lake City, MO",2032,619
6897500,"Grand River near Gallatin, MO",2062,713
6897950,"Elk Creek near Decatur City, IA",2059,798
6898000,"Thompson River at Davis City, IA",2069,791
6898400,"Weldon River near Leon, IA",2083,797
6899500,"Thompson River at Trenton, MO",2087,731
6900000,"MEDICINE CREEK NEAR GALT, MO",2110,735
6902000,"Grand River near Sumner, MO",2119,684
6903400,"Chariton River near Chariton, IA",2115,825
6903700,"South Fork Chariton River near Promise City, IA",2120,809
6903900,"Chariton River near Rathbun, IA",2146,813
6904010,"Chariton River near Moulton, IA",2156,799
6904050,"Chariton River at Livonia, MO",2164,776
6904500,"Chariton River at Novinger, MO",2166,749
6905500,"Chariton River near Prairie Hill, MO",2158,671
6906000,"Mussel Fork near Musselfork, MO",2147,668
6906200,"East Fork Little Chariton R. nr Macon, MO",2182,694
6906300,"East Fork Little Chariton R. nr Huntsville, MO",2178,661
6908000,"Blackwater River at Blue Lick, MO",2126,609
6910800,"MARAIS DES CYGNES R NR READING, KS",1887,559
6911500,"SALT C NR LYNDON, KS",1915,562
6911900,"DRAGOON C NR BURLINGAME, KS",1899,575
6912500,"HUNDRED AND TEN MILE C NR QUENEMO, KS",1923,568
6913000,"MARAIS DES CYGNES R NR POMONA, KS",1931,561
6913500,"MARAIS DES CYGNES R NR OTTAWA, KS",1947,563
6914000,"POTTAWATOMIE C NR GARNETT, KS",1949,534
6915000,"BIG BULL C NR HILLSDALE, KS",1980,568
6915800,"MARAIS DES CYGNES R AT LA CYGNE, KS",1992,533
6916600,"MARAIS DES CYGNES R NR KS-MO ST LINE, KS",2001,522
6917000,"L OSAGE R AT FULTON, KS",1997,499
6917380,"MARMATON R NR MARMATON, KS",1992,476
6918440,"Sac River near Dadeville, MO",2088,438
6918460,"Turnback Creek above Greenfield, MO",2079,433
6918740,"Little Sac River near Morrisville, MO",2105,443
6919000,"Sac River near Stockton, MO",2081,465
6919020,"Sac River at Hwy J below Stockton, MO",2079,470
6919500,"Cedar Creek near Pleasant View, MO",2072,481
6919900,"Sac River near Caplinger Mills, MO",2078,485
6921070,"Pomme de Terre River near Polk, MO",2115,462
6921200,"Lindley Creek near Polk, MO",2124,473
6921350,"Pomme de Terre River near Hermitage, MO",2119,490
6921590,"South Grand River at Archie, MO",2031,549
6926000,"Osage River near Bagnell, MO",2181,523
6926500,"Osage River near St. Thomas, MO",2209,541
6932000,"Little Piney Creek at Newburg, MO",2242,494
6933500,"Gasconade River at Jerome, MO",2236,497
7013000,"Meramec River near Steelville, MO",2290,505
7014500,"Meramec River near Sullivan, MO",2312,526
7015720,"Bourbeuse River near High Gate, MO",2271,522
7016500,"Bourbeuse River at Union, MO",2320,557
7017200,"Big River at Irondale, MO",2350,492
7018100,"Big River near Richwoods, MO",2345,528
7018500,"Big River at Byrnesville, MO",2351,554
7019000,"Meramec River near Eureka, MO",2353,565
7021000,"Castor River at Zalma, MO",2409,418
7024000,"BAYOU DE CHIEN NEAR CLINTON, KY",2510,368
7024300,"BEAVER CREEK AT HUNTINGDON, TN",2563,304
7024500,"SOUTH FORK OBION RIVER NEAR GREENFIELD, TN",2528,312
7026000,"OBION RIVER AT OBION, TN",2493,326
7026040,"OBION RIVER AT HWY 51 NEAR OBION, TN",2491,325
7029100,"NORTH FORK FORKED DEER RIVER AT DYERSBURG, TN",2477,298
7029500,"HATCHIE RIVER AT BOLIVAR, TN",2522,220
7030240,"LOOSAHATCHIE RIVER NEAR ARLINGTON, TN",2460,218
7031650,"WOLF RIVER AT GERMANTOWN, TN",2447,197
7035000,"Little St. Francis River at Fredericktown, MO",2385,462
7036100,"St. Francis River near Saco, MO",2372,442
7037500,"St. Francis River near Patterson, MO",2372,421
7039500,"St. Francis River at Wappapello, MO",2394,393
7047942,"LAnguille River near Colt, AR",2349,194
7048600,"White River near Fayetteville, AR",2058,286
7050700,"James River near Springfield, MO",2131,405
7052500,"James River at Galena, MO",2109,366
7053500,"White River near Branson, MO",2127,345
7056000,"Buffalo River near St. Joe, AR",2178,279
7057500,"North Fork River near Tecumseh, MO",2219,350
7058000,"Bryant Creek near Tecumseh, MO",2215,350
7060500,"White River at Calico Rock, AR",2231,294
7060710,"North Sylamore Creek near Fifty Six, AR",2226,280
7061300,"EAST FORK BLACK RIVER AT LESTERVILLE, MO",2339,448
7061500,"Black River near Annapolis, MO",2345,435
7062500,"Black River at Leeper, MO",2355,405
7063000,"Black River at Poplar Bluff, MO",2387,373
7064000,"Black River near Corning, AR",2376,339
7066000,"Jacks Fork at Eminence, MO",2296,412
7067000,"Current River at Van Buren, MO",2328,395
7068000,"Current River at Doniphan, MO",2345,356
7068510,"Little Black River below Fairdealing, MO",2369,358
7069500,"SPRING RIVER AT IMBODEN, ARK.",2318,308
7071500,"Eleven Point River near Bardley, MO",2313,357
7072000,"ELEVENPOINT RIVER NR RAVENDEN SPRINGS, ARK.",2322,324
7072500,"Black River at Black Rock, AR",2330,297
7074000,"STRAWBERRY RIVER NEAR POUGHKEEPSIE, ARK.",2294,297
7075300,"SO FORK OF LITTLE RED RIV AT CLINTON, ARK.",2205,236
7077380,"Cache River at Egypt, AR",2342,271
7077950,BIG CREEK AT POPLAR GROVE,2356,130
7083000,"HALFMOON CREEK NEAR MALTA, CO.",993,675
7084500,"LAKE CREEK ABOVE TWIN LAKES RESERVOIR, CO.",992,665
7086000,"ARKANSAS RIVER AT GRANITE, CO.",1004,660
7086500,"CLEAR CREEK ABOVE CLEAR CREEK RESERVOIR, CO.",1001,658
7089000,"COTTONWOOD C BL HOT SPRINGS, NR BUENA VISTA, CO.",1003,634
7093700,"ARKANSAS RIVER NEAR WELLSVILLE, CO.",1025,598
7094500,"ARKANSAS RIVER AT PARKDALE, CO.",1073,590
7095000,"GRAPE CREEK NEAR WESTCLIFFE, CO.",1059,560
7096000,"ARKANSAS RIVER AT CANON CITY, CO.",1084,584
7096500,"FOURMILE CREEK NEAR CANON CITY, CO.",1088,585
7097000,"ARKANSAS RIVER AT PORTLAND, CO.",1104,578
7099215,"TURKEY CREEK NEAR FOUNTAIN, CO",1117,601
7099230,"TURKEY CREEK AB TELLER RES NEAR STONE CITY, CO.",1120,583
7099400,"ARKANSAS RIVER ABOVE PUEBLO, CO.",1128,561
7103700,"FOUNTAIN CREEK NEAR COLORADO SPRINGS, CO.",1120,628
7103747,"MONUMENT CREEK AT PALMER LAKE, CO",1122,654
7103800,"WEST MONUMENT CREEK AT AIR FORCE ACADEMY, CO.",1120,640
7104000,"MONUMENT CREEK AT PIKEVIEW, CO.",1126,633
7105500,"FOUNTAIN CREEK AT COLORADO SPRINGS, CO.",1125,622
7105800,"FOUNTAIN CREEK AT SECURITY, CO.",1131,612
7105900,"JIMMY CAMP CREEK AT FOUNTAIN, CO.",1134,606
7105945,"ROCK CREEK ABOVE FORT CARSON RESERVATION, CO.",1122,612
7105950,"ROCK CREEK NEAR FORT CARSON, CO.",1123,610
7106300,"FOUNTAIN CREEK NEAR PINON, CO.",1139,579
7106500,"FOUNTAIN CREEK AT PUEBLO, CO.",1137,564
7108900,"ST. CHARLES RIVER AT VINELAND, CO.",1146,556
7109500,"ARKANSAS RIVER NEAR AVONDALE, CO.",1156,558
7116500,"HUERFANO RIVER NEAR BOONE, CO.",1165,553
7117000,"ARKANSAS RIVER NEAR NEPESTA, CO.",1175,548
7119500,"APISHAPA RIVER NEAR FOWLER, CO.",1188,535
7119700,"ARKANSAS RIVER AT CATLIN DAM, NEAR FOWLER, CO.",1197,540
7121500,"TIMPAS CREEK AT MOUTH NEAR SWINK, CO.",1218,525
7122400,"CROOKED ARROYO NEAR SWINK, CO.",1222,523
7123000,"ARKANSAS RIVER AT LA JUNTA, CO.",1227,523
7124000,"ARKANSAS RIVER AT LAS ANIMAS, CO.",1257,529
7124200,"PURGATOIRE RIVER AT MADRID, CO.",1123,435
7124410,"PURGATOIRE RIVER BELOW TRINIDAD LAKE, CO.",1131,437
7126200,"VAN BREMER ARROYO NEAR MODEL, CO.",1183,453
7126300,"PURGATOIRE RIVER NEAR THATCHER, CO.",1190,456
7126325,"TAYLOR ARROYO BL ROCK CROSSING, NR THATCHER, CO.",1189,464
7126390,"LOCKWOOD CANYON CREEK NEAR THATCHER, CO.",1197,469
7126415,"RED ROCK CANYON CREEK AT MOUTH NR THATCHER, CO.",1206,471
7126485,"PURGATOIRE RIVER AT ROCK CROSSING NR TIMPAS, CO.",1218,480
7126500,"PURGATOIRE RIVER AT NINEMILE DAM, NR HIGBEE, CO.",1227,491
7128500,"PURGATOIRE RIVER NEAR LAS ANIMAS, CO.",1256,523
7130500,"ARKANSAS RIVER BELOW JOHN MARTIN RESERVOIR, CO.",1281,527
7139800,"MULBERRY C NR DODGE CITY, KS",1531,460
7140850,"PAWNEE R NR BURDETT, KS",1568,526
7141200,"PAWNEE R AT ROZEL, KS",1588,525
7141780,"WALNUT C AT NEKOMA, KS",1586,555
7141900,"WALNUT C AT ALBERT, KS",1622,552
7142300,"RATTLESNAKE C NR MACKSVILLE, KS",1632,485
7142575,"RATTLESNAKE C NR ZENITH, KS",1662,508
7142620,"RATTLESNAKE C NR RAYMOND, KS",1674,523
7143300,"COW C NR LYONS, KS",1693,533
7143665,"L ARKANSAS R AT ALTA MILLS, KS",1745,510
7144200,"L ARKANSAS R AT VALLEY CENTER, KS",1761,478
