STAID,STANAME,Final_i,Final_j
4195500,Portage River at Woodville OH,2932,952
4196800,Tymochtee Creek at Crawford OH,2945,893
4197100,Honey Creek at Melmore OH,2961,906
4197170,Rock Creek at Tiffin OH,2954,920
4198000,Sandusky River near Fremont OH,2952,938
4200500,Black River at Elyria OH,3038,958
4201500,Rocky River near Berea OH,3056,964
4202000,Cuyahoga River at Hiram Rapids OH,3116,965
4206000,Cuyahoga River at Old Portage OH,3087,939
4207200,Tinkers Creek at Bedford OH,3084,965
4208000,Cuyahoga River at Independence OH,3076,966
4212100,Grand River near Painesville OH,3103,1007
4213000,Conneaut Creek at Conneaut OH,3151,1038
4213040,"Raccoon Creek near West Springfield, PA",3163,1042
4213500,CATTARAUGUS CR AT GOWANDA NY,3275,1123
4214500,BUFFALO CREEK AT GARDENVILLE NY,3283,1166
4215000,CAYUGA CREEK NR LANCASTER NY,3289,1171
4215500,CAZENOVIA CREEK AT EBENEZER NY,3279,1161
4216200,SCAJAQUADA CREEK AT BUFFALO NY,3281,1171
4216418,TONAWANDA CREEK AT ATTICA NY,3319,1174
4216500,LITTLE TONAWANDA CREEK AT LINDEN NY,3328,1178
4217000,TONAWANDA CREEK AT BATAVIA NY,3326,1189
4217500,TONAWANDA CREEK NEAR ALABAMA NY,3301,1196
4218000,TONAWANDA CREEK AT RAPIDS NY,3285,1194
4218518,ELLICOTT CREEK BELOW WILLIAMSVILLE NY,3279,1179
4230380,OATKA CREEK AT WARSAW NY,3333,1164
5014500,Swiftcurrent Creek at Many Glacier MT,585,1821
5017500,St. Mary River near Babb MT,602,1823
5046000,"OTTER TAIL RIVER BL ORWELL D NR FERGUS FALLS, MN",1868,1412
5050000,"BOIS DE SIOUX RIVER NEAR WHITE ROCK, SD",1839,1365
5051500,"RED RIVER OF THE NORTH AT WAHPETON, ND",1832,1411
5051522,"RED RIVER OF THE NORTH AT HICKSON, ND",1823,1456
5053000,"WILD RICE RIVER NR ABERCROMBIE, ND",1826,1433
5054000,"RED RIVER OF THE NORTH AT FARGO, ND",1826,1477
5054500,"SHEYENNE RIVER ABOVE HARVEY, ND",1586,1578
5056000,"SHEYENNE RIVER NR WARWICK, ND",1679,1585
5057000,"SHEYENNE RIVER NR COOPERSTOWN, ND",1732,1544
5057200,"BALDHILL CREEK NR DAZEY, ND",1722,1520
5058000,"SHEYENNE RIVER BELOW BALDHILL DAM, ND",1727,1500
5058700,"SHEYENNE RIVER AT LISBON, ND",1755,1432
5059000,"SHEYENNE RIVER NEAR KINDRED, ND",1802,1447
5059500,"SHEYENNE RIVER AT WEST FARGO, ND",1804,1463
5059700,"MAPLE RIVER NR ENDERLIN, ND",1765,1464
5060500,"RUSH RIVER AT AMENIA, ND",1792,1495
5062000,"BUFFALO RIVER NEAR DILWORTH, MN",1833,1495
5064900,"BEAVER CREEK NR FINLEY, ND",1755,1561
5066500,"GOOSE RIVER AT HILLSBORO, ND",1804,1539
5074500,"RED LAKE RIVER NEAR RED LAKE, MN",1939,1601
5075000,"RED LAKE RIVER AT HIGH LANDING NR GOODRIDGE, MN",1901,1605
5076000,"THIEF RIVER NEAR THIEF RIVER FALLS, MN",1873,1627
5078000,"CLEARWATER RIVER AT PLUMMER, MN",1881,1597
5078230,"LOST RIVER AT OKLEE, MN",1896,1586
5078500,"CLEARWATER RIVER AT RED LAKE FALLS, MN",1863,1593
5079000,"RED LAKE RIVER AT CROOKSTON, MN",1838,1580
5083600,"MIDDLE BRANCH FOREST RIVER NR WHITMAN, ND",1728,1631
5084000,"FOREST RIVER NR FORDVILLE, ND",1754,1627
5085000,"FOREST RIVER AT MINTO, ND",1784,1637
5087500,"MIDDLE RIVER AT ARGYLE, MN",1825,1642
5089000,"SOUTH BRANCH PARK RIVER BELOW HOMME DAM, ND",1753,1652
5090000,"PARK RIVER AT GRAFTON, ND",1782,1669
5098700,"HIDDEN ISLAND COULEE NR HANSBORO, ND",1625,1719
5098800,"CYPRESS CREEK NR SARLES, ND",1665,1715
5104500,"ROSEAU RIVER BELOW SOUTH FORK NEAR MALUNG, MN",1903,1695
5116500,"DES LACS RIVER AT FOXHOLM, ND",1468,1660
5120500,"WINTERING RIVER NR KARLSRUHE, ND",1547,1625
5123400,"WILLOW CREEK NR WILLOW CITY, ND",1554,1680
5124480,"KAWISHIWI RIVER NEAR ELY, MN",2220,1603
5127000,"KAWISHIWI RIVER NEAR WINTON, MN",2204,1604
5127500,"BASSWOOD RIVER NEAR WINTON, MN",2212,1618
5129115,"VERMILION RIVER NR CRANE LAKE, MN",2143,1640
5130500,"STURGEON RIVER NEAR CHISHOLM, MN",2120,1573
5131500,"LITTLE FORK RIVER AT LITTLEFORK, MN",2068,1653
5132000,"BIG FORK RIVER AT BIG FALLS, MN",2050,1628
5211000,"MISSISSIPPI RIVER AT GRAND RAPIDS, MN",2070,1516
5216860,"SWAN RIVER NEAR CALUMET, MN",2095,1529
5220500,"MISSISSIPPI RIVER BELOW SANDY RIVER NR LIBBY, MN",2088,1474
5227500,"MISSISSIPPI RIVER AT AITKIN, MN",2061,1446
5245100,"LONG PRAIRIE RIVER AT LONG PRAIRIE, MN",1974,1380
5247500,"CROW WING RIVER NEAR PILLAGER, MN",2011,1417
5267000,"MISSISSIPPI RIVER NEAR ROYALTON, MN",2013,1368
5275000,"ELK RIVER NEAR BIG LAKE, MN",2062,1308
5278000,"MIDDLE FORK CROW RIVER NEAR SPICER, MN",1979,1299
5280000,"CROW RIVER AT ROCKFORD, MN",2065,1269
5286000,"RUM RIVER NEAR ST. FRANCIS, MN",2093,1309
5287890,"ELM CREEK NR CHAMPLIN, MN",2087,1292
5291000,"WHETSTONE RIVER NEAR BIG STONE CITY, SD",1842,1301
5292000,"MINNESOTA RIVER AT ORTONVILLE, MN",1850,1304
5293000,"YELLOW BANK RIVER NEAR ODESSA, MN",1856,1294
5294000,"POMME DE TERRE RIVER AT APPLETON, MN",1884,1293
5300000,"LAC QUI PARLE RIVER NEAR LAC QUI PARLE, MN",1890,1271
5304500,"CHIPPEWA RIVER NEAR MILAN, MN",1901,1283
5311000,"MINNESOTA RIVER AT MONTEVIDEO, MN",1905,1264
5311400,"SOUTH BRANCH YELLOW MEDICINE R AT MINNEOTA, MN",1885,1221
5313500,"YELLOW MEDICINE RIVER NEAR GRANITE FALLS, MN",1917,1233
5315000,"REDWOOD RIVER NEAR MARSHALL, MN",1897,1208
5316500,"REDWOOD RIVER NEAR REDWOOD FALLS, MN",1950,1217
5317000,"COTTONWOOD RIVER NEAR NEW ULM, MN",2008,1192
5317200,"LITTLE COTTONWOOD RIVER NEAR COURTLAND, MN",2017,1187
5319500,"WATONWAN RIVER NEAR GARDEN CITY, MN",2022,1168
5320000,"BLUE EARTH RIVER NEAR RAPIDAN, MN",2035,1170
5320500,"LE SUEUR RIVER NEAR RAPIDAN, MN",2043,1172
5327000,"HIGH ISLAND CREEK NEAR HENDERSON, MN",2051,1223
5330000,"MINNESOTA RIVER NEAR JORDAN, MN",2071,1238
5333500,"ST. CROIX RIVER NEAR DANBURY, WI",2180,1398
5336700,"KETTLE RIVER BELOW SANDSTONE, MN",2128,1396
5337400,"KNIFE RIVER NEAR MORA, MN",2095,1376
5340050,"SUNRISE RIVER NEAR LINDSTROM, MN",2126,1322
5340500,"ST. CROIX RIVER AT ST. CROIX FALLS, WI",2147,1319
5345000,"VERMILLION RIVER NEAR EMPIRE, MN",2118,1236
5353800,"STRAIGHT RIVER NEAR FARIBAULT, MN",2105,1190
5356000,"CHIPPEWA RIVER AT BISHOPS BRIDGE NEAR WINTER, WI",2268,1374
5356500,"CHIPPEWA RIVER NEAR BRUCE, WI",2256,1329
5360500,"FLAMBEAU RIVER NEAR BRUCE, WI",2279,1318
5362000,"JUMP RIVER AT SHELDON, WI",2286,1318
5368000,"HAY RIVER AT WHEELER, WI",2210,1281
5369000,"RED CEDAR RIVER AT MENOMONIE, WI",2206,1264
5369500,"CHIPPEWA RIVER AT DURAND, WI",2204,1236
5370000,"EAU GALLE RIVER AT SPRING VALLEY, WI",2183,1259
5372995,"SOUTH FORK ZUMBRO RIVER AT ROCHESTER, MN",2168,1170
5376000,"NORTH FORK WHITEWATER RIVER NEAR ELBA, MN",2201,1176
5379500,"TREMPEALEAU RIVER AT DODGE, WI",2241,1181
5381000,"BLACK RIVER AT NEILLSVILLE, WI",2313,1233
5382000,"BLACK RIVER NEAR GALESVILLE, WI",2261,1176
5384000,"ROOT RIVER NEAR LANESBORO, MN",2208,1138
5388250,"Upper Iowa River near Dorchester, IA",2245,1104
5391000,"WISCONSIN RIVER @ RAINBOW LAKE NR LAKE TOMAHAWK,WI",2388,1380
5393500,"SPIRIT RIVER AT SPIRIT FALLS, WI",2356,1334
5394500,"PRAIRIE RIVER NEAR MERRILL, WI",2384,1313
5395000,"WISCONSIN RIVER AT MERRILL, WI",2381,1307
5397500,"EAU CLAIRE RIVER AT KELLY, WI",2395,1279
5398000,"WISCONSIN RIVER AT ROTHSCHILD, WI",2387,1274
5399500,"BIG EAU PLEINE RIVER AT STRATFORD, WI",2353,1265
5400650,"LITTLE PLOVER RIVER AT PLOVER, WI",2398,1229
5400760,"WISCONSIN RIVER AT WISCONSIN RAPIDS, WI",2375,1219
5402000,"YELLOW RIVER AT BABCOCK, WI",2362,1207
5403500,"LEMONWEIR RIVER AT NEW LISBON, WI",2354,1160
5404000,"WISCONSIN RIVER NEAR WISCONSIN DELLS, WI",2388,1132
5405000,"BARABOO RIVER NEAR BARABOO, WI",2397,1119
5406500,"BLACK EARTH CREEK AT BLACK EARTH, WI",2393,1080
5407000,"WISCONSIN RIVER AT MUSCODA, WI",2336,1083
5408000,"KICKAPOO RIVER AT LA FARGE, WI",2317,1126
5410490,"KICKAPOO RIVER AT STEUBEN, WI",2301,1081
5411600,"Turkey River at Spillville, IA",2211,1079
5412500,"Turkey River at Garber, IA",2271,1031
5413500,"GRANT RIVER AT BURTON, WI",2309,1028
5414000,"PLATTE RIVER NEAR ROCKVILLE, WI",2323,1030
5414820,"SINSINAWA RIVER NEAR MENOMINEE, IL",2336,1005
5415000,"GALENA RIVER AT BUNCOMBE, WI",2346,1009
5418500,"Maquoketa River near Maquoketa, IA",2326,959
5419000,"APPLE RIVER NEAR HANOVER, IL",2355,979
5420560,"Wapsipinicon River near Elma, IA",2165,1081
5421000,"Wapsipinicon River at Independence, IA",2221,997
5422000,"Wapsipinicon River near De Witt, IA",2338,925
5422470,"Crow Creek at Bettendorf, IA",2346,904
5425500,"ROCK RIVER AT WATERTOWN, WI",2473,1088
5426000,"CRAWFISH RIVER AT MILFORD, WI",2464,1082
5426250,"BARK RIVER NEAR ROME, WI",2487,1069
5427570,"ROCK RIVER AT INDIANFORD, WI",2447,1048
5427948,"PHEASANT BRANCH AT MIDDLETON, WI",2409,1078
5429500,"YAHARA RIVER AT MC FARLAND, WI",2428,1070
5430150,"BADFISH CREEK NEAR COOKSVILLE, WI",2436,1055
5430175,"YAHARA RIVER NEAR FULTON, WI",2444,1053
5430500,"ROCK RIVER AT AFTON, WI",2452,1026
5431017,"DELAVAN LAKE INLET AT ST HWY 50 AT LAKE LAWN, WI",2491,1032
5431022,"DELAVAN LAKE OUTLET AT BORG RD NEAR DELAVAN, WI",2486,1030
5431486,"TURTLE CREEK AT CARVERS ROCK ROAD NEAR CLINTON, WI",2470,1027
5432500,"PECATONICA RIVER AT DARLINGTON, WI",2366,1029
5433000,"EAST BR PECATONICA RIVER NEAR BLANCHARDVILLE, WI",2384,1042
5434500,"PECATONICA RIVER AT MARTINTOWN, WI",2392,1012
5435500,"PECATONICA RIVER AT FREEPORT, IL",2410,990
5436500,"SUGAR RIVER NEAR BRODHEAD, WI",2425,1025
5437500,"ROCK RIVER AT ROCKTON, IL",2456,1008
5438500,"KISHWAUKEE RIVER AT BELVIDERE, IL",2471,990
5439000,"SOUTH BRANCH KISHWAUKEE RIVER AT DEKALB, IL",2482,954
5439500,SOUTH BRANCH KISHWAUKEE RIVER NR FAIRDALE IL,2470,972
5440000,"KISHWAUKEE RIVER NEAR PERRYVILLE, IL",2461,978
5443500,"ROCK RIVER AT COMO, IL",2404,929
5444000,"ELKHORN CREEK NEAR PENROSE, IL",2405,945
5446500,"ROCK RIVER NEAR JOSLIN, IL",2370,916
5447500,"GREEN RIVER NEAR GENESEO, IL",2371,898
5448000,"MILL CREEK AT MILAN, IL",2339,890
5449000,"East Branch Iowa River near Klemme, IA",2077,1053
5449500,"Iowa River near Rowan, IA",2080,1024
5451500,"Iowa River at Marshalltown, IA",2139,950
5451700,"Timber Creek near Marshalltown, IA",2145,942
5451900,"Richland Creek near Haven, IA",2175,932
5452000,"Salt Creek near Elberon, IA",2188,941
5452200,"Walnut Creek near Hartwick, IA",2183,926
5453000,"Big Bear Creek at Ladora, IA",2200,916
5453100,"Iowa River at Marengo, IA",2211,922
5454000,"Rapid Creek near Iowa City, IA",2258,913
5454300,"Clear Creek near Coralville, IA",2250,910
5454500,"Iowa River at Iowa City, IA",2255,910
5455000,"Ralston Creek at Iowa City, IA",2256,909
5455010,"South Branch Ralston Creek at Iowa City, IA",2256,909
5455100,"Old Mans Creek near Iowa City, IA",2248,904
5455500,"English River at Kalona, IA",2241,888
5455700,"Iowa River near Lone Tree, IA",2262,883
5457000,"CEDAR RIVER NEAR AUSTIN, MN",2128,1122
5457700,"CEDAR RIVER AT CHARLES CITY, IA",2156,1059
5458000,"Little Cedar River near Ionia, IA",2169,1058
5458500,"Cedar River at Janesville, IA",2175,1015
5458900,"West Fork Cedar River at Finchford, IA",2169,1010
5459000,"Shell Rock River near Northwood, IA",2110,1097
5459500,"Winnebago River at Mason City, IA",2114,1070
5462000,"Shell Rock River at Shell Rock, IA",2163,1023
5463000,"Beaver Creek at New Hartford, IA",2161,1006
5463500,"Black Hawk Creek at Hudson, IA",2174,987
5464000,"Cedar River at Waterloo, IA",2186,998
5464500,"Cedar River at Cedar Rapids, IA",2232,941
5465000,"Cedar River near Conesville, IA",2278,883
5465500,"Iowa River at Wapello, IA",2288,858
5466000,"EDWARDS RIVER NEAR ORION, IL",2354,872
5466500,"EDWARDS RIVER NEAR NEW BOSTON, IL",2304,860
5467000,"POPE CREEK NEAR KEITHSBURG, IL",2309,852
5469000,"HENDERSON CREEK NEAR OQUAWKA, IL",2317,840
5470000,"South Skunk River near Ames, IA",2082,949
5470500,"Squaw Creek at Ames, IA",2079,948
5471500,"South Skunk River near Oskaloosa, IA",2162,872
5472500,"North Skunk River near Sigourney, IA",2203,865
5473400,"Cedar Creek near Oakland Mills, IA",2248,826
5474000,"Skunk River at Augusta, IA",2281,810
5476000,"DES MOINES RIVER AT JACKSON, MN",1968,1116
5476500,"DES MOINES RIVER AT ESTHERVILLE, IA",1979,1092
5476750,"Des Moines River at Humboldt, IA",2030,1020
5479000,"East Fork Des Moines River at Dakota City, IA",2033,1018
5480500,"Des Moines River at Fort Dodge, IA",2033,994
5481000,"Boone River near Webster City, IA",2066,989
5481300,"Des Moines River near Stratford, IA",2051,966
5481650,"Des Moines River near Saylorville, IA",2072,912
5481950,"Beaver Creek near Grimes, IA",2074,906
5482170,"Big Cedar Creek near Varina, IA",1982,1024
5482300,"North Raccoon River near Sac City, IA",1969,976
5482500,"North Raccoon River near Jefferson, IA",2014,947
5483000,"East Fork Hardin Creek near Churdan, IA",2019,954
5483450,"Middle Raccoon River near Bayard, IA",2009,914
5483600,"Middle Raccoon River at Panora, IA",2021,905
5484000,"South Raccoon River at Redfield, IA",2039,895
5484500,"Raccoon River at Van Meter, IA",2056,888
5484800,"Walnut Creek at Des Moines, IA",2075,895
5485500,"Des Moines River blw Raccoon Riv at Des Moines, IA",2083,894
5485640,"Fourmile Creek at Des Moines, IA",2089,899
5486000,"North River near Norwalk, IA",2079,880
5486490,"Middle River near Indianola, IA",2085,876
5487470,"South River near Ackworth, IA",2093,866
5487980,"White Breast Creek near Dallas, IA",2112,857
5488500,"Des Moines River near Tracy, IA",2147,864
5489000,"Cedar Creek near Bussey, IA",2142,855
5489500,"Des Moines River at Ottumwa, IA",2184,835
5490500,"Des Moines River at Keosauqua, IA",2224,805
5495000,"Fox River at Wayland, MO",2258,768
5495500,"BEAR CREEK NEAR MARCELLINE, IL",2279,742
5496000,"Wyaconda River above Canton, MO",2260,740
5497000,"North Fabius River at Monticello, MO",2249,736
5498000,"Middle Fabius River near Monticello, MO",2248,735
5500000,"South Fabius River near Taylor, MO",2262,714
5501000,"North River at Palmyra, MO",2268,707
5502000,"Bear Creek at Hannibal, MO",2277,692
5502040,"HADLEY CREEK AT KINDERHOOK, IL",2298,694
5502300,"Salt River at Hagers Grove, MO",2207,703
5503800,"Crooked Creek near Paris, MO",2228,679
5504800,"South Fork Salt River above Santa Fe, MO",2243,651
5505000,"SOUTH FORK SALT RIVER AT SANTA FE, MO.",2246,653
5506500,"MIDDLE FORK SALT RIVER AT PARIS, MO.",2227,667
5506800,"Elk Fork Salt River near Madison, MO",2214,661
5507600,"Lick Creek at Perry, MO",2255,662
5507800,"Salt River near Center, MO",2263,680
5508000,"Salt River near New London, MO",2278,684
5508805,"Spencer Cr. bl Plum Cr. nr Frankford, MO",2284,675
5512500,"BAY CREEK AT PITTSFIELD, IL",2328,688
5513000,"BAY CREEK AT NEBO, IL",2329,667
5514500,"CUIVRE RIVER NEAR TROY, MO",2318,618
5515000,"KANKAKEE RIVER NEAR NORTH LIBERTY, IND.",2674,932
5515500,"KANKAKEE RIVER AT DAVIS, IND.",2658,906
5516500,"YELLOW RIVER AT PLYMOUTH, IND.",2690,907
5517000,"YELLOW RIVER AT KNOX, IND.",2666,902
5517500,"KANKAKEE RIVER AT DUNNS BRIDGE, IND.",2639,894
5517530,"KANKAKEE RIVER NR KOUTS, IND.",2631,893
5518000,"KANKAKEE RIVER AT SHELBY, IN",2606,887
5520500,"KANKAKEE RIVER AT MOMENCE, IL",2579,876
5521000,"IROQUOIS RIVER AT ROSEBUD, IND.",2623,866
5522000,"IROQUOIS RIVER NEAR NORTH MARION, IND.",2628,859
5522500,"IROQUOIS RIVER AT RENSSELAER, IND.",2627,855
5524500,"IROQUOIS RIVER NEAR FORESMAN, IN",2612,847
5525000,"IROQUOIS RIVER AT IROQUOIS, IL",2590,840
5525500,"SUGAR CREEK AT MILFORD, IL",2580,819
5526000,"IROQUOIS RIVER NEAR CHEBANSE, IL",2568,859
5527500,"KANKAKEE RIVER NEAR WILMINGTON, IL",2534,894
5527800,"DES PLAINES RIVER AT RUSSELL, IL",2546,1022
5528000,"DES PLAINES RIVER NEAR GURNEE, IL",2545,1004
5528500,"BUFFALO CREEK NEAR WHEELING, IL",2547,983
5529000,"DES PLAINES RIVER NEAR DES PLAINES, IL",2552,976
5529500,"MC DONALD CREEK NEAR MOUNT PROSPECT, IL",2551,976
5530000,"WELLER CREEK AT DES PLAINES, IL",2551,973
5530990,"SALT CREEK AT ROLLING MEADOWS, IL",2543,972
5531500,"SALT CREEK AT WESTERN SPRINGS, IL",2555,948
5532000,"ADDISON CREEK AT BELLWOOD, IL",2561,952
5532500,"DES PLAINES RIVER AT RIVERSIDE, IL",2571,951
5533000,"FLAG CREEK NEAR WILLOW SPRINGS, IL",2555,938
5534500,"NORTH BRANCH CHICAGO RIVER AT DEERFIELD, IL",2558,986
5535000,"SKOKIE RIVER AT LAKE FOREST, IL",2553,993
5535070,"SKOKIE RIVER NEAR HIGHLAND PARK, IL",2559,985
5535500,WF OF NB CHICAGO RIVER AT NORTHBROOK IL,2557,982
5536000,"NORTH BRANCH CHICAGO RIVER AT NILES, IL",2568,969
5536195,"LITTLE CALUMET RIVER AT MUNSTER, IND.",2588,924
5536215,"THORN CREEK AT GLENWOOD, IL",2579,918
5536235,"DEER CREEK NEAR CHICAGO HEIGHTS, IL",2585,917
5536255,"BUTTERFIELD CREEK AT FLOSSMOOR, IL",2579,919
5536275,"THORN CREEK AT THORNTON, IL",2580,922
5536290,"LITTLE CALUMET RIVER AT SOUTH HOLLAND, IL",2583,928
5536340,"MIDLOTHIAN CREEK AT OAK FOREST, IL",2573,928
5536500,"TINLEY CREEK NEAR PALOS PARK, IL",2568,930
5536995,"CHICAGO SANITARY AND SHIP CA AT ROMEOVILLE, IL",2542,926
5537500,"LONG RUN NEAR LEMONT, IL",2547,927
5539000,"HICKORY CREEK AT JOLIET, IL",2543,914
5539900,"W BRANCH DU PAGE RIVER NR WEST CHICAGO, IL",2531,955
5540095,"WEST BR DU PAGE RIVER NEAR WARRENVILLE, IL",2531,945
5540500,"DU PAGE RIVER AT SHOREWOOD, IL",2534,912
5542000,"MAZON RIVER NEAR COAL CITY, IL",2521,887
5543500,"ILLINOIS RIVER AT MARSEILLES, IL",2490,887
5543830,"FOX RIVER AT WAUKESHA, WI",2514,1075
5544200,"MUKWONAGO RIVER AT MUKWONAGO, WI",2508,1060
5548280,"NIPPERSINK CREEK NEAR SPRING GROVE, IL",2521,1013
5550000,"FOX RIVER AT ALGONQUIN, IL",2519,982
5550500,"POPLAR CREEK AT ELGIN, IL",2523,967
5551200,"FERSON CREEK NEAR ST. CHARLES, IL",2516,956
5551700,"BLACKBERRY CREEK NEAR YORKVILLE, IL",2510,926
5552500,"FOX RIVER AT DAYTON, IL",2484,892
5554500,"VERMILION RIVER AT PONTIAC, IL",2502,837
5555300,"VERMILION RIVER NEAR LEONORE, IL",2476,872
5556500,"BIG BUREAU CREEK AT PRINCETON, IL",2425,888
5558300,"ILLINOIS RIVER AT HENRY, IL",2440,858
5560500,"FARM CREEK AT FARMDALE, IL",2431,810
5561500,"FONDULAC CREEK NEAR EAST PEORIA, IL",2429,810
5567500,"MACKINAW RIVER NEAR CONGERVILLE, IL",2454,808
5568500,"ILLINOIS RIVER AT KINGSTON MINES, IL",2410,795
5568800,"INDIAN CREEK NEAR WYOMING, IL",2400,846
5569500,"SPOON RIVER AT LONDON MILLS, IL",2367,809
5570000,"SPOON RIVER AT SEVILLE, IL",2362,787
5570360,"EVELYN BRANCH NEAR BRYANT, IL",2382,786
5570370,"BIG CREEK NEAR BRYANT, IL",2380,782
5570910,"SANGAMON RIVER AT FISHER, IL",2534,779
5572000,"SANGAMON RIVER AT MONTICELLO, IL",2515,747
5573540,"SANGAMON RIVER AT RT 48 AT DECATUR, IL",2483,721
5576000,"SOUTH FORK SANGAMON RIVER NR ROCHESTER, IL",2435,704
5577500,"SPRING CREEK AT SPRINGFIELD, IL",2420,714
5578500,"SALT CREEK NEAR ROWELL, IL",2473,752
5579500,"LAKE FORK NEAR CORNLAND, IL",2448,732
5580000,"KICKAPOO CREEK AT WAYNESVILLE, IL",2467,768
5580950,"SUGAR CREEK NEAR BLOOMINGTON, IL",2472,790
5582000,"SALT CREEK NEAR GREENVIEW, IL",2415,748
5583000,"SANGAMON RIVER NEAR OAKFORD, IL",2396,747
5584500,"LA MOINE RIVER AT COLMAR, IL",2317,766
5585000,"LA MOINE RIVER AT RIPLEY, IL",2342,732
5587000,"MACOUPIN CREEK NEAR KANE, IL",2367,647
5587900,"CAHOKIA CREEK AT EDWARDSVILLE, IL",2404,604
5588000,"INDIAN CREEK AT WANDA, IL",2400,605
5590800,"LAKE FORK AT ATWOOD, IL",2525,723
5591200,"KASKASKIA RIVER AT COOKS MILLS, IL",2534,699
5591550,"WHITLEY CREEK NEAR ALLENVILLE, IL",2523,689
5591700,"WEST OKAW RIVER NEAR LOVINGTON, IL",2510,711
5592000,"KASKASKIA RIVER AT SHELBYVILLE, IL",2503,677
5592050,"ROBINSON CREEK NEAR SHELBYVILLE, IL",2494,674
5592100,"KASKASKIA RIVER NEAR COWDEN, IL",2499,657
5592500,"KASKASKIA RIVER AT VANDALIA, IL",2481,623
5592800,"HURRICANE CREEK NEAR MULBERRY GROVE, IL",2467,618
5592900,"EAST FORK KASKASKIA RIVER NEAR SANDOVAL, IL",2481,595
5593000,"KASKASKIA RIVER AT CARLYLE, IL",2460,583
5593520,"CROOKED CREEK NEAR HOFFMAN, IL",2467,573
5593575,"LITTLE CROOKED CREEK NEAR NEW MINDEN, IL",2451,561
5593900,"EAST FORK SHOAL CREEK NEAR COFFEEN, IL",2456,642
5594000,"SHOAL CREEK NEAR BREESE, IL",2448,582
5594100,"KASKASKIA RIVER NEAR VENEDY STATION, IL",2432,565
5594450,"SILVER CREEK NEAR TROY, IL",2418,592
5594800,"SILVER CREEK NEAR FREEBURG, IL",2424,563
5595200,"RICHLAND CREEK NEAR HECKER, IL",2410,548
5595730,"RAYSE CREEK NEAR WALTONVILLE, IL",2491,547
5597000,"BIG MUDDY RIVER AT PLUMFIELD, IL",2495,507
5597500,"CRAB ORCHARD CREEK NEAR MARION, IL",2507,489
6016000,Beaverhead River at Barretts MT,575,1405
6018500,Beaverhead River near Twin Bridges MT,604,1430
6019500,Ruby River ab Reservoir nr Alder MT,624,1405
6020600,Ruby River bl Reservoir nr Alder MT,627,1410
6025500,Big Hole River near Melrose MT,586,1449
6033000,Boulder River near Boulder MT,648,1514
6036650,Jefferson River near Three Forks MT,681,1473
6036905,Firehole River near West Yellowstone MT,712,1325
6037500,Madison River near West Yellowstone MT,696,1332
6038500,Madison River bl Hebgen Lake nr Grayling MT,680,1356
6041000,Madison River bl Ennis Lake nr Mcallister MT,667,1429
6043500,Gallatin River near Gallatin Gateway MT,697,1427
6050000,Hyalite C at Hyalite R S nr Bozeman MT,716,1441
6052500,Gallatin River at Logan MT,691,1470
6054500,Missouri River at Toston MT,696,1500
6061500,Prickly Pear Creek near Clancy MT,663,1546
6062500,Tenmile Creek near Rimini MT,640,1552
6066500,Missouri River bl Holter Dam nr Wolf Cr MT,668,1600
6076690,Smith River near Ft Logan MT,728,1567
6088300,Muddy Creek near Vaughn MT,709,1663
6088500,Muddy Creek at Vaughn MT,714,1656
6089000,Sun River near Vaughn MT,716,1653
6091700,Two Medicine River bl South Fork nr Browning MT,625,1771
6093200,Badger Cr bl Four Horns Canal nr Browning MT,638,1763
6099000,Cut Bank Creek at Cut Bank MT,676,1784
6099500,Marias River near Shelby MT,704,1757
6101500,Marias River near Chester MT,762,1731
6108000,Teton River near Dutton MT,721,1698
6120500,Musselshell River at Harlowton MT,821,1510
6126500,Musselshell River near Roundup MT,919,1497
6130500,Musselshell River at Mosby MT,979,1551
6131000,Big Dry Creek near Van Norman MT,1100,1577
6131200,Nelson Creek near Van Norman MT,1117,1596
6137400,Big Sandy Cr at Res Bndry nr Rocky Boy MT,852,1702
6137570,Boxelder Creek near Rocky Boy MT,855,1717
6154400,Peoples Creek near Hays MT,935,1697
6154410,Little Peoples Creek near Hays MT,935,1668
6154550,Peoples Cr bl Kuhr Coulee nr Dodson MT,964,1707
6174000,Willow Creek near Glasgow MT,1085,1664
6177500,REDWATER RIVER AT CIRCLE MT,1158,1576
6186500,Yellowstone River at Yellowstone Lk Outlet YNP,749,1311
6191000,Gardner River near Mammoth YNP,732,1363
6191500,Yellowstone River at Corwin Springs MT,726,1378
6192500,Yellowstone River near Livingston MT,752,1427
6195600,Shields River nr Livingston MT,761,1441
6200000,Boulder River at Big Timber MT,804,1445
6204050,West Rosebud Creek near Roscoe MT,812,1380
6205000,Stillwater River near Absarokee MT,843,1408
6207500,Clarks Fork Yellowstone River nr Belfry MT,858,1346
6212500,Red Lodge Cr bl Cooney Reservoir nr Boyd MT,857,1395
6214500,Yellowstone River at Billings MT,916,1425
6216000,Pryor Creek at Pryor MT,908,1387
6216900,Pryor Creek nr Huntley MT,932,1427
6218500,"WIND RIVER NEAR DUBOIS, WY",781,1196
6220500,EAST FORK WIND RIVER NR DUBOIS WYO,802,1178
6224000,"BULL LAKE CREEK ABOVE BULL LAKE, WY",818,1145
6225000,"BULL LAKE CREEK NEAR LENORE, WY",833,1155
6225500,"WIND RIVER NEAR CROWHEART, WY",837,1154
6228000,"WIND RIVER AT RIVERTON, WY",883,1118
6228350,"SF L WIND RIV AB WASHAKIE RES, NR FT WASHAKIE, WY",827,1121
6235500,"LITTLE WIND RIVER NEAR RIVERTON, WY",883,1117
6259000,WIND R BL BOYSEN RES WYO,905,1162
6260000,"SOUTH FORK OWL CREEK NEAR ANCHOR, WY",855,1195
6260400,"SOUTH FORK OWL CREEK BELOW ANCHOR RESERVOIR, WY",859,1195
6267400,"EAST FORK NOWATER CREEK NEAR COLTER, WYO.",931,1212
6268500,"FIFTEEN MILE CREEK NEAR WORLAND, WYO.",926,1225
6270000,"NOWOOD RIVER NEAR TENSLEEP, WY",973,1218
6274300,"BIGHORN RIVER AT BASIN, WY",931,1264
6275000,"WOOD RIVER AT SUNSHINE, WYO.",851,1238
6278300,"SHELL CREEK ABOVE SHELL CREEK RESERVOIR, WY",981,1273
6279500,"BIGHORN RIVER AT KANE, WY",925,1309
6280300,"SOUTH FORK SHOSHONE RIVER NEAR VALLEY, WY",808,1264
6281000,"SOUTH FORK SHOSHONE RIVER AB BUFFALO BILL RES, WY",834,1283
6282000,"SHOSHONE RIVER BELOW BUFFALO BILL RESERVOIR, WY",849,1292
6284500,"BITTER CREEK NEAR GARLAND, WY",893,1311
6284800,"WHISTLE CREEK NEAR GARLAND, WY",892,1308
6285100,"SHOSHONE RIVER NEAR LOVELL, WY",905,1320
6285400,"SAGE CREEK AT SIDON CANAL, NEAR DEAVER, WY",896,1327
6289000,Little Bighorn River at State Line nr Wyola MT,973,1330
6289820,"EAST PASS CREEK NEAR DAYTON, WY",987,1327
6290000,Pass Creek near Wyola MT,992,1333
6290500,Little Bighorn R bl Pass Cr nr Wyola MT,993,1347
6291500,Lodge Grass Cr ab Willow C Div nr Wyola MT,975,1343
6294000,Little Bighorn River near Hardin MT,986,1408
6295113,Rosebud C at Reservation Bndry nr Kirby MT,1026,1363
6295250,Rosebud Creek near Colstrip MT,1062,1403
6298000,"TONGUE RIVER NEAR DAYTON, WY",993,1308
6305700,"GOOSE CREEK NEAR ACME, WY",1020,1309
6306300,Tongue River at State Line nr Decker MT,1034,1323
6307500,Tongue River at Tongue R Dam nr Decker MT,1039,1335
6307616,Tongue R at Birney Day School Br nr Birney MT,1069,1364
6307740,Otter Creek at Ashland MT,1086,1380
6308400,Pumpkin Creek near Miles City MT,1137,1446
6308500,Tongue River at Miles City MT,1128,1464
6309200,"MIDDLE FORK POWDER RIVER NEAR BARNUM, WY",991,1167
6309500,"MIDDLE FORK POWDER RIVER ABOVE KAYCEE, WY",1016,1173
6311000,"NORTH FORK POWDER RIVER NEAR HAZELTON, WY",1000,1216
6311400,"NF POWDER RIVER BELOW PASS CREEK, NR MAYOWORTH, WY",1013,1203
6317000,"POWDER RIVER AT ARVADA, WY",1084,1277
6318500,"CLEAR CREEK NEAR BUFFALO, WYO.",1029,1247
6323000,"PINEY CREEK AT KEARNY, WYO.",1029,1269
6324500,Powder River at Moorhead MT,1109,1319
6324970,"LITTLE POWDER RIVER AB DRY CREEK, NEAR WESTON, WY",1147,1299
6326500,Powder River near Locate MT,1168,1467
6332515,"BEAR DEN CREEK NR MANDAREE, ND",1375,1599
6334500,LITTLE MISSOURI R AT CAMP CROOK SD,1263,1358
6335500,"LITTLE MISSOURI RIVER AT MARMARTH, ND",1275,1442
6337000,"LITTLE MISSOURI RIVER NR WATFORD CITY, ND",1335,1580
6339100,"KNIFE RIVER AT MANNING, ND",1369,1538
6339500,"KNIFE RIVER NR GOLDEN VALLEY, ND",1423,1525
6340000,"SPRING CREEK AT ZAP, ND",1435,1540
6340500,"KNIFE RIVER AT HAZEN, ND",1457,1538
6341800,"PAINTED WOODS CREEK NR WILTON, ND",1522,1532
6342260,"SQUARE BUTTE CREEK BELOW CENTER, ND",1490,1510
6344600,"GREEN RIVER NR NEW HRADEC, ND",1346,1518
